{
  "schema_version": 1,
  "revision": 1,
  "plan_id": "CLN-20260817-abcdef12",
  "created_at": "2026-08-17T12:30:00Z",
  "git_sha": "not-a-git-repository",
  "inventory_revision": 1,
  "inventory_sha256": "2333b63fbb25b0bef29fdc99cc80f0cf268df11b81eea968ee4aef2d1c54e126",
  "boundary_fingerprints": [
    { "path": "package.json", "sha256": "e3b0c44298fc1c149afbf4c8996fb92427ae41e4649b934ca495991b7852b855" },
    { "path": "go.work", "sha256": "e3b0c44298fc1c149afbf4c8996fb92427ae41e4649b934ca495991b7852b855" },
    { "path": "apps/web/package.json", "sha256": "e3b0c44298fc1c149afbf4c8996fb92427ae41e4649b934ca495991b7852b855" },
    { "path": ".github/workflows/web.yml", "sha256": "e3b0c44298fc1c149afbf4c8996fb92427ae41e4649b934ca495991b7852b855" },
    { "path": "services/api/go.mod", "sha256": "e3b0c44298fc1c149afbf4c8996fb92427ae41e4649b934ca495991b7852b855" },
    { "path": "deploy/api.yaml", "sha256": "e3b0c44298fc1c149afbf4c8996fb92427ae41e4649b934ca495991b7852b855" }
  ],
  "work_item_id": "WI-20260817-11111111",
  "status": "proposed",
  "requested_intent": "Clean confirmed obsolete code and reproducible outputs after initialization",
  "scope": {
    "paths": ["services/api-old", "apps/web/dist", "apps/web/coverage", "shared"],
    "components": ["CMP-api", "CMP-web", "CMP-shared"]
  },
  "items": [
    {
      "id": "CLN-I001",
      "source_path": "services/api-old",
      "source_fingerprint": "e3b0c44298fc1c149afbf4c8996fb92427ae41e4649b934ca495991b7852b855",
      "tracked": true,
      "path_type": "directory",
      "category": "code",
      "classification": "deprecated-confirmed",
      "action": "archive-code",
      "target_path": ".ai-flow/archive/legacy-code/v1.2.0/services/api-old",
      "target_existed_before": false,
      "target_fingerprint_before": null,
      "target_fingerprint_after": "e3b0c44298fc1c149afbf4c8996fb92427ae41e4649b934ca495991b7852b855",
      "owning_components": ["CMP-api"],
      "evidence": ["not referenced by go.work", "not referenced by CI or deployment", "user confirmed replacement"],
      "risk": "high",
      "ignore_pattern": null,
      "approval": "pending",
      "result": "pending",
      "recovery": {
        "kind": "git",
        "reference": "abcdef1234567 plus reverse path mapping",
        "verified": true
      }
    },
    {
      "id": "CLN-I002",
      "source_path": "apps/web/dist",
      "source_fingerprint": "e3b0c44298fc1c149afbf4c8996fb92427ae41e4649b934ca495991b7852b855",
      "tracked": false,
      "path_type": "directory",
      "category": "generated",
      "classification": "generated",
      "action": "remove-generated",
      "target_path": null,
      "target_existed_before": false,
      "target_fingerprint_before": null,
      "target_fingerprint_after": null,
      "owning_components": ["CMP-web"],
      "evidence": ["Vite output", "reproduced by npm run build"],
      "risk": "low",
      "ignore_pattern": null,
      "approval": "pending",
      "result": "pending",
      "recovery": {
        "kind": "regenerate",
        "reference": "npm --prefix apps/web run build",
        "verified": true
      }
    },
    {
      "id": "CLN-I003",
      "source_path": "shared",
      "source_fingerprint": "e3b0c44298fc1c149afbf4c8996fb92427ae41e4649b934ca495991b7852b855",
      "tracked": true,
      "path_type": "directory",
      "category": "code",
      "classification": "shared",
      "action": "keep",
      "target_path": null,
      "target_existed_before": false,
      "target_fingerprint_before": null,
      "target_fingerprint_after": null,
      "owning_components": ["CMP-web", "CMP-shared"],
      "evidence": ["active CMP-web dependency"],
      "risk": "critical",
      "ignore_pattern": null,
      "approval": "not-required",
      "result": "kept",
      "recovery": {
        "kind": "none",
        "reference": null,
        "verified": true
      }
    },
    {
      "id": "CLN-I004",
      "source_path": "apps/web/coverage",
      "source_fingerprint": "e3b0c44298fc1c149afbf4c8996fb92427ae41e4649b934ca495991b7852b855",
      "tracked": false,
      "path_type": "directory",
      "category": "artifact",
      "classification": "obsolete-artifact",
      "action": "add-ignore-rule",
      "target_path": "apps/web/.gitignore",
      "target_existed_before": false,
      "target_fingerprint_before": null,
      "target_fingerprint_after": "5c5daf48fdf4db42e16c29b5b3de54984bafe0c2ff367a186ca97f1d4ed48290",
      "owning_components": ["CMP-web"],
      "evidence": ["coverage output is generated by the test command"],
      "risk": "low",
      "ignore_pattern": "coverage/",
      "approval": "pending",
      "result": "pending",
      "recovery": {
        "kind": "git",
        "reference": "revert the approved .gitignore line",
        "verified": true
      }
    }
  ],
  "batches": [
    {
      "id": "CLN-B001",
      "item_ids": ["CLN-I002", "CLN-I004"],
      "affected_components": ["CMP-web"],
      "languages": ["TypeScript"],
      "preconditions": ["source fingerprint unchanged", "no overlapping worktree changes"],
      "before_commands": ["npm --prefix apps/web test"],
      "before_evidence_ids": [],
      "after_commands": ["npm --prefix apps/web run build", "npm --prefix apps/web test"],
      "after_evidence_ids": [],
      "rollback_commands": ["npm --prefix apps/web run build"],
      "recovery_evidence_ids": [],
      "mutation_started_at": null,
      "mutation_completed_at": null,
      "status": "pending"
    },
    {
      "id": "CLN-B002",
      "item_ids": ["CLN-I001"],
      "affected_components": ["CMP-api"],
      "languages": ["Go"],
      "preconditions": ["source fingerprint unchanged", "no CI or deployment reference", "exact mapping approved"],
      "before_commands": ["go test ./services/api/..."],
      "before_evidence_ids": [],
      "after_commands": ["go test ./services/api/..."],
      "after_evidence_ids": [],
      "rollback_commands": ["restore the reverse git mv mapping"],
      "recovery_evidence_ids": [],
      "mutation_started_at": null,
      "mutation_completed_at": null,
      "status": "pending"
    }
  ],
  "summary": {
    "affected_components": ["CMP-api", "CMP-web"],
    "archive_count": 1,
    "removal_count": 1,
    "ignore_rule_count": 1,
    "kept_count": 1,
    "residual_risks": ["External deployment references require user confirmation before approval"]
  },
  "approval": {
    "required": true,
    "status": "pending",
    "approved_by": null,
    "approved_at": null,
    "mapping_sha256": null
  },
  "completed_at": null,
  "completed_git_sha": null,
  "verification_evidence_ids": []
}
